{
  "schema_version": "serving-policy-v1",
  "status": "BOUNDED_MEASURED_POLICY_NOT_GLOBAL_OPTIMUM",
  "deployment_point": {
    "model": "Qwen3.5-0.8B",
    "gpu": "NVIDIA GeForce RTX 4060 Laptop GPU, SM89",
    "engine": "vLLM 0.28.1rc1.dev312+g41848caa6",
    "decode": "greedy, 64 generated tokens",
    "scope": "steady-state service after engine initialization"
  },
  "policy_input": {
    "path": "bf16_serving_policy_spec.json",
    "sha256": "b81fb2abfa9aad44a378de1106564f2a46f01c8490ab09d776e6cc80ab26c80d"
  },
  "identity": {
    "model": "/home/aden/models/Qwen3.5-0.8B",
    "workload_identity": {
      "harness_sha256": "36af89e52a4d868addc706f36eb927d3276f1b6abc5c5e1d6157813c31e46d64",
      "prompt_token_ids_sha256": [
        "1a27d458b872af262ee4fbf54ed5f0905fa226dd11ef651d2cb87471b77d3661",
        "7f91dbb7096b79e8f0a26e548f74e96de812d6317de7facbae3f1036bf8ab0ef",
        "30128ca05fabd8b0db235be1db9331bf298cacdea88eebd80808186011403ef9",
        "bae053209ffcf1cf3764f548d02f2832ffa86aed6454e18d07e01f93dcc48536",
        "441471a4c957b7af9d6b33ffa13da05a8fc637dca0ba1c71974b579c74915d88",
        "061d29e0385385bee10b9b5dc6a7dcc429f194c69f8eaf11377baffc126f7242"
      ],
      "prompt_count": 6,
      "request_selection": "prompt[(iteration + request_index) % prompt_count]"
    },
    "gpu": "NVIDIA GeForce RTX 4060 Laptop GPU",
    "vllm": "0.28.1rc1.dev312+g41848caa6",
    "torch": "2.13.0+cu130",
    "cuda": "13.0",
    "controls": {
      "quantization": "none",
      "new_tokens": 64,
      "warmups": 1,
      "trials": 3,
      "ignore_eos": true,
      "sampling": "greedy",
      "case_order": "batch sizes forward/reverse by trial"
    },
    "batch_sizes": [
      1,
      2,
      4,
      8
    ]
  },
  "global_optimum_proven": false,
  "routes": [
    {
      "numerical_contract": "stock_token_identity",
      "active_decode_batch": 1,
      "route": "stock_vllm_bf16",
      "reason": "exact_bf16_packed_lm_head: stock-token identity failed"
    },
    {
      "numerical_contract": "stock_token_identity",
      "active_decode_batch": 2,
      "route": "stock_vllm_bf16",
      "reason": "exact_bf16_packed_lm_head: speedup below threshold"
    },
    {
      "numerical_contract": "stock_token_identity",
      "active_decode_batch": 4,
      "route": "stock_vllm_bf16",
      "reason": "exact_bf16_packed_lm_head: speedup below threshold"
    },
    {
      "numerical_contract": "stock_token_identity",
      "active_decode_batch": 8,
      "route": "stock_vllm_bf16",
      "reason": "exact_bf16_packed_lm_head: speedup below threshold"
    },
    {
      "numerical_contract": "bf16_weight_exact_reduction_order_drift_allowed",
      "active_decode_batch": 1,
      "route": "exact_bf16_packed_lm_head",
      "reason": "candidate clears conservative speedup and numerical-contract gates",
      "measured_conservative_speedup_over_baseline": 1.0488783219120628
    },
    {
      "numerical_contract": "bf16_weight_exact_reduction_order_drift_allowed",
      "active_decode_batch": 2,
      "route": "stock_vllm_bf16",
      "reason": "exact_bf16_packed_lm_head: speedup below threshold"
    },
    {
      "numerical_contract": "bf16_weight_exact_reduction_order_drift_allowed",
      "active_decode_batch": 4,
      "route": "stock_vllm_bf16",
      "reason": "exact_bf16_packed_lm_head: speedup below threshold"
    },
    {
      "numerical_contract": "bf16_weight_exact_reduction_order_drift_allowed",
      "active_decode_batch": 8,
      "route": "stock_vllm_bf16",
      "reason": "exact_bf16_packed_lm_head: speedup below threshold"
    }
  ],
  "evidence": {
    "stock_token_identity:exact_bf16_packed_lm_head": {
      "baseline_inputs": [
        {
          "path": "../traces/vllm_bf16_exact_strict_stock_a_service_curve.json",
          "sha256": "d9003104076ef3426d003438072ae0bb52bcfe6800978260d5a9743a01d9fe6d"
        },
        {
          "path": "../traces/vllm_bf16_exact_strict_stock_b_service_curve.json",
          "sha256": "e5c919acefd78a69bfbdfbed26136a46e32985e32e113e586e70e09e2755112b"
        }
      ],
      "baseline_challenger_inputs": [
        {
          "path": "../traces/vllm_bf16_exact_source_stock_service_curve_b1_b2_b4_b8.json",
          "sha256": "382d0107491176f0abcf8847727f234d08e7bb7c846d086d2faa51ac46095650",
          "use": "BASELINE_ENVELOPE_VETO_ONLY"
        }
      ],
      "candidate_inputs": [
        {
          "path": "../traces/vllm_bf16_exact_strict_candidate_a_service_curve.json",
          "sha256": "d3b98727f145f9fd19a91bc94e3423b12ad9a71f075423b5088cc6dff373b383"
        },
        {
          "path": "../traces/vllm_bf16_exact_strict_candidate_b_service_curve.json",
          "sha256": "b55030857856dab55ca503eff746903b91135060cfd032e059a91f09e310e719"
        }
      ],
      "candidate_lifecycle_inputs": [
        {
          "path": "../comparisons/vllm_bf16_exact_packed_service_integration.json",
          "sha256": "9dacef19521386d76d0abbcbe8629cc68d776cdfc777e5aa6596713ae9c1bf2e"
        },
        {
          "path": "../candidates/exact-bf16-packed-lmhead/vllm_utils_exact_bf16_packed_lmhead.patch",
          "sha256": "a1d4f2ed86ba45b580c49b274a917d1b8402517177d0eb129a7099ee9420874e"
        }
      ],
      "by_batch": {
        "1": {
          "baseline_conservative_tps": 103.01939579362957,
          "candidate_conservative_tps": 108.0548109844168,
          "conservative_speedup": 1.0488783219120628,
          "correctness": {
            "exact_requests": 10,
            "request_count": 12,
            "exact_tokens": 758,
            "token_count": 768,
            "all_requests_exact": false,
            "token_identity_fraction": 0.9869791666666666
          }
        },
        "2": {
          "baseline_conservative_tps": 205.7560092479143,
          "candidate_conservative_tps": 193.8820163178415,
          "conservative_speedup": 0.9422909057505782,
          "correctness": {
            "exact_requests": 22,
            "request_count": 24,
            "exact_tokens": 1426,
            "token_count": 1536,
            "all_requests_exact": false,
            "token_identity_fraction": 0.9283854166666666
          }
        },
        "4": {
          "baseline_conservative_tps": 413.1373794158697,
          "candidate_conservative_tps": 358.5677100800766,
          "conservative_speedup": 0.8679139868366582,
          "correctness": {
            "exact_requests": 42,
            "request_count": 48,
            "exact_tokens": 2846,
            "token_count": 3072,
            "all_requests_exact": false,
            "token_identity_fraction": 0.9264322916666666
          }
        },
        "8": {
          "baseline_conservative_tps": 696.6878647874861,
          "candidate_conservative_tps": 655.6190435807239,
          "conservative_speedup": 0.9410513326232693,
          "correctness": {
            "exact_requests": 77,
            "request_count": 96,
            "exact_tokens": 5751,
            "token_count": 6144,
            "all_requests_exact": false,
            "token_identity_fraction": 0.93603515625
          }
        }
      }
    },
    "bf16_weight_exact_reduction_order_drift_allowed:exact_bf16_packed_lm_head": {
      "baseline_inputs": [
        {
          "path": "../traces/vllm_bf16_exact_strict_stock_a_service_curve.json",
          "sha256": "d9003104076ef3426d003438072ae0bb52bcfe6800978260d5a9743a01d9fe6d"
        },
        {
          "path": "../traces/vllm_bf16_exact_strict_stock_b_service_curve.json",
          "sha256": "e5c919acefd78a69bfbdfbed26136a46e32985e32e113e586e70e09e2755112b"
        }
      ],
      "baseline_challenger_inputs": [
        {
          "path": "../traces/vllm_bf16_exact_source_stock_service_curve_b1_b2_b4_b8.json",
          "sha256": "382d0107491176f0abcf8847727f234d08e7bb7c846d086d2faa51ac46095650",
          "use": "BASELINE_ENVELOPE_VETO_ONLY"
        }
      ],
      "candidate_inputs": [
        {
          "path": "../traces/vllm_bf16_exact_strict_candidate_a_service_curve.json",
          "sha256": "d3b98727f145f9fd19a91bc94e3423b12ad9a71f075423b5088cc6dff373b383"
        },
        {
          "path": "../traces/vllm_bf16_exact_strict_candidate_b_service_curve.json",
          "sha256": "b55030857856dab55ca503eff746903b91135060cfd032e059a91f09e310e719"
        }
      ],
      "candidate_lifecycle_inputs": [
        {
          "path": "../comparisons/vllm_bf16_exact_packed_service_integration.json",
          "sha256": "9dacef19521386d76d0abbcbe8629cc68d776cdfc777e5aa6596713ae9c1bf2e"
        },
        {
          "path": "../candidates/exact-bf16-packed-lmhead/vllm_utils_exact_bf16_packed_lmhead.patch",
          "sha256": "a1d4f2ed86ba45b580c49b274a917d1b8402517177d0eb129a7099ee9420874e"
        }
      ],
      "by_batch": {
        "1": {
          "baseline_conservative_tps": 103.01939579362957,
          "candidate_conservative_tps": 108.0548109844168,
          "conservative_speedup": 1.0488783219120628,
          "correctness": {
            "exact_requests": 10,
            "request_count": 12,
            "exact_tokens": 758,
            "token_count": 768,
            "all_requests_exact": false,
            "token_identity_fraction": 0.9869791666666666
          }
        },
        "2": {
          "baseline_conservative_tps": 205.7560092479143,
          "candidate_conservative_tps": 193.8820163178415,
          "conservative_speedup": 0.9422909057505782,
          "correctness": {
            "exact_requests": 22,
            "request_count": 24,
            "exact_tokens": 1426,
            "token_count": 1536,
            "all_requests_exact": false,
            "token_identity_fraction": 0.9283854166666666
          }
        },
        "4": {
          "baseline_conservative_tps": 413.1373794158697,
          "candidate_conservative_tps": 358.5677100800766,
          "conservative_speedup": 0.8679139868366582,
          "correctness": {